{
  "schema_version": "1.0",
  "runtime_version": "1.1.0",
  "abi_version": "0x0101",
  "profile": "STANDARD",
  "deployment_id": "product-line/control-domain/0001",
  "config_revision": 1,
  "config_fingerprint": "0x0000000000000000",
  "config_fingerprint_version": 1,
  "anchor_format_version": 2,
  "build": {
    "toolchain": "record-target-toolchain",
    "compiler_flags": "record-release-flags",
    "build_tag": "release",
    "runtime_storage_bytes": 1,
    "source_archive_sha256": "0000000000000000000000000000000000000000000000000000000000000000"
  },
  "clock": {
    "resolution_us": 1,
    "uncertainty_us": 0,
    "monotonicity_test": "not-run",
    "failure_injection": "not-run"
  },
  "modules": [],
  "actuators": [],
  "ingress": {
    "producer_count": 1,
    "burst_observations": 0,
    "overflow_behavior": "record target result"
  },
  "safe_state": {
    "startup": "not-run",
    "world_break": "not-run",
    "controlled_stop": "not-run",
    "brownout": "not-run",
    "watchdog_reset": "not-run"
  },
  "verification": [],
  "disposition": {
    "status": "not-qualified",
    "owner": "integration-owner",
    "date": "2026-08-11",
    "notes": "Replace placeholder values with target qualification evidence."
  }
}
